[{"productId":"215063","productName":"Ovos Mantiqueira Galinha Pintadinha 12un","brand":"Mantiqueira","link":"https://www.supermuffato.com.br/ovo-mantiqueira-galinha-pintadinha-12un-215063/p","items":[{"itemId":"215063","name":"Ovos Mantiqueira Galinha Pintadinha 12un","nameComplete":"Ovos Mantiqueira Galinha Pintadinha 12un","complementName":"","ean":"7896982100981","measurementUnit":"un","unitMultiplier":1.0000,"isKit":false,"sellers":[{"sellerId":"1","sellerName":"Super Muffato Delivery","commertialOffer":{"Price":8.2,"ListPrice":8.2,"FullSellingPrice":8.2,"IsAvailable":true,"AvailableQuantity":99999,"DiscountHighLight":[],"Teasers":[],"PromotionTeasers":[],"BuyTogether":[],"PaymentOptions":{"installmentOptions":[{"paymentSystem":"2","bin":null,"paymentName":"Visa","paymentGroupName":"creditCardPaymentGroup","value":820,"installments":[{"count":1,"hasInterestRate":false,"interestRate":0,"value":820,"total":820,"sellerMerchantInstallments":[{"id":"MUFFATOSUPERMERCADOS","count":1,"hasInterestRate":false,"interestRate":0,"value":820,"total":820}]}]},{"paymentSystem":"125","bin":null,"paymentName":"Pix","paymentGroupName":"instantPaymentPaymentGroup","value":820,"installments":[{"count":1,"hasInterestRate":false,"interestRate":0,"value":820,"total":820,"sellerMerchantInstallments":[{"id":"MUFFATOSUPERMERCADOS","count":1,"hasInterestRate":false,"interestRate":0,"value":820,"total":820}]}]}]},"Installments":[{"Value":8.2,"InterestRate":0.0,"TotalValuePlusInterestRate":8.2,"NumberOfInstallments":1,"PaymentSystemName":"Visa","PaymentSystemGroupName":"creditCardPaymentGroup","Name":"Visa à vista"},{"Value":8.2,"InterestRate":0.0,"TotalValuePlusInterestRate":8.2,"NumberOfInstallments":1,"PaymentSystemName":"Pix","PaymentSystemGroupName":"instantPaymentPaymentGroup","Name":"Pix à vista"}]}}]}]},{"productId":"60834","productName":"Macarrão Isabela com Ovos Parafuso 500g","brand":"Isabela","link":"https://www.supermuffato.com.br/macarrao-isabela-com-ovos-parafuso-500g-60834/p","items":[{"itemId":"60834","name":"Macarrão Isabela Parafuso 500g","nameComplete":"Macarrão Isabela com Ovos Parafuso 500g Macarrão Isabela Parafuso 500g","complementName":"","ean":"7896022033026","measurementUnit":"un","unitMultiplier":1.0000,"isKit":false,"sellers":[{"sellerId":"1","sellerName":"Super Muffato Delivery","commertialOffer":{"Price":3.5,"ListPrice":3.5,"FullSellingPrice":3.5,"IsAvailable":true,"AvailableQuantity":99999,"DiscountHighLight":[],"Teasers":[],"PromotionTeasers":[],"BuyTogether":[],"PaymentOptions":{"installmentOptions":[{"paymentSystem":"2","bin":null,"paymentName":"Visa","paymentGroupName":"creditCardPaymentGroup","value":350,"installments":[{"count":1,"hasInterestRate":false,"interestRate":0,"value":350,"total":350,"sellerMerchantInstallments":[{"id":"MUFFATOSUPERMERCADOS","count":1,"hasInterestRate":false,"interestRate":0,"value":350,"total":350}]}]},{"paymentSystem":"125","bin":null,"paymentName":"Pix","paymentGroupName":"instantPaymentPaymentGroup","value":350,"installments":[{"count":1,"hasInterestRate":false,"interestRate":0,"value":350,"total":350,"sellerMerchantInstallments":[{"id":"MUFFATOSUPERMERCADOS","count":1,"hasInterestRate":false,"interestRate":0,"value":350,"total":350}]}]}]},"Installments":[{"Value":3.5,"InterestRate":0.0,"TotalValuePlusInterestRate":3.5,"NumberOfInstallments":1,"PaymentSystemName":"Visa","PaymentSystemGroupName":"creditCardPaymentGroup","Name":"Visa à vista"},{"Value":3.5,"InterestRate":0.0,"TotalValuePlusInterestRate":3.5,"NumberOfInstallments":1,"PaymentSystemName":"Pix","PaymentSystemGroupName":"instantPaymentPaymentGroup","Name":"Pix à vista"}]}}]}]},{"productId":"303169","productName":"Sepercoffe Cafeína 3.0 10g Choconilla","brand":"CAFFEINE ARMY","link":"https://www.supermuffato.com.br/sepercoffe-cafeina-3-0-10g-choconilla-303169/p","items":[{"itemId":"303169","name":"Supercoffe Cafeína 3.0 10g Choconilla","nameComplete":"Sepercoffe Cafeína 3.0 10g Choconilla Supercoffe Cafeína 3.0 10g Choconilla","complementName":"","ean":"618341625525","measurementUnit":"un","unitMultiplier":1.0000,"isKit":false,"sellers":[{"sellerId":"1","sellerName":"Super Muffato Delivery","commertialOffer":{"Price":9.3,"ListPrice":9.3,"FullSellingPrice":9.3,"IsAvailable":true,"AvailableQuantity":99999,"DiscountHighLight":[],"Teasers":[],"PromotionTeasers":[],"BuyTogether":[],"PaymentOptions":{"installmentOptions":[{"paymentSystem":"2","bin":null,"paymentName":"Visa","paymentGroupName":"creditCardPaymentGroup","value":930,"installments":[{"count":1,"hasInterestRate":false,"interestRate":0,"value":930,"total":930,"sellerMerchantInstallments":[{"id":"MUFFATOSUPERMERCADOS","count":1,"hasInterestRate":false,"interestRate":0,"value":930,"total":930}]}]},{"paymentSystem":"125","bin":null,"paymentName":"Pix","paymentGroupName":"instantPaymentPaymentGroup","value":930,"installments":[{"count":1,"hasInterestRate":false,"interestRate":0,"value":930,"total":930,"sellerMerchantInstallments":[{"id":"MUFFATOSUPERMERCADOS","count":1,"hasInterestRate":false,"interestRate":0,"value":930,"total":930}]}]}]},"Installments":[{"Value":9.3,"InterestRate":0.0,"TotalValuePlusInterestRate":9.3,"NumberOfInstallments":1,"PaymentSystemName":"Visa","PaymentSystemGroupName":"creditCardPaymentGroup","Name":"Visa à vista"},{"Value":9.3,"InterestRate":0.0,"TotalValuePlusInterestRate":9.3,"NumberOfInstallments":1,"PaymentSystemName":"Pix","PaymentSystemGroupName":"instantPaymentPaymentGroup","Name":"Pix à vista"}]}}]}]},{"productId":"304544","productName":"Café em Cápsula Torrado e Moído Espresso Chocolate L'or Caixa 52g 10 Unidades","brand":"L'OR","link":"https://www.supermuffato.com.br/cafe-em-capsula-torrado-e-moido-espresso-chocolate-lor-caixa-52g-10-unidades-304544/p","items":[{"itemId":"304544","name":"Café em Cápsula Torrado e Moído Espresso Chocolate L'or Caixa 52g 10 Unidades","nameComplete":"Café em Cápsula Torrado e Moído Espresso Chocolate L'or Caixa 52g 10 Unidades","complementName":"","ean":"8711000488195","measurementUnit":"un","unitMultiplier":1.0000,"isKit":false,"sellers":[{"sellerId":"1","sellerName":"Super Muffato Delivery","commertialOffer":{"Price":23.6,"ListPrice":23.6,"FullSellingPrice":23.6,"IsAvailable":true,"AvailableQuantity":100,"DiscountHighLight":[],"Teasers":[],"PromotionTeasers":[],"BuyTogether":[],"PaymentOptions":{"installmentOptions":[{"paymentSystem":"2","bin":null,"paymentName":"Visa","paymentGroupName":"creditCardPaymentGroup","value":2360,"installments":[{"count":1,"hasInterestRate":false,"interestRate":0,"value":2360,"total":2360,"sellerMerchantInstallments":[{"id":"MUFFATOSUPERMERCADOS","count":1,"hasInterestRate":false,"interestRate":0,"value":2360,"total":2360}]}]},{"paymentSystem":"125","bin":null,"paymentName":"Pix","paymentGroupName":"instantPaymentPaymentGroup","value":2360,"installments":[{"count":1,"hasInterestRate":false,"interestRate":0,"value":2360,"total":2360,"sellerMerchantInstallments":[{"id":"MUFFATOSUPERMERCADOS","count":1,"hasInterestRate":false,"interestRate":0,"value":2360,"total":2360}]}]}]},"Installments":[{"Value":23.6,"InterestRate":0.0,"TotalValuePlusInterestRate":23.6,"NumberOfInstallments":1,"PaymentSystemName":"Visa","PaymentSystemGroupName":"creditCardPaymentGroup","Name":"Visa à vista"},{"Value":23.6,"InterestRate":0.0,"TotalValuePlusInterestRate":23.6,"NumberOfInstallments":1,"PaymentSystemName":"Pix","PaymentSystemGroupName":"instantPaymentPaymentGroup","Name":"Pix à vista"}]}}]}]}]
