[{"productId":"7590","productName":"Banana Nanica Aproximadamente 100g/un","brand":"Festval","link":"https://www.festval.com/banana-nanica-kg/p","items":[{"itemId":"7515","name":"Banana Nanica Aproximadamente 100g/un","nameComplete":"Banana Nanica Aproximadamente 100g/un","complementName":"Banana Nanica Aproximadamente 100g/un para consumo diário, ideal para lanches, vitaminas e receitas variadas que buscam sabor e nutrição.","ean":"5705","measurementUnit":"kg","unitMultiplier":0.1000,"isKit":false,"sellers":[{"sellerId":"1","sellerName":"FESTVAL","commertialOffer":{"Price":7.99,"ListPrice":7.99,"FullSellingPrice":0.79,"AvailableQuantity":0,"IsAvailable":false,"DiscountHighLight":[],"Teasers":[],"PromotionTeasers":[],"BuyTogether":[],"PaymentOptions":{"installmentOptions":[]}}}]}]},{"productId":"5556","productName":"Bife de Patinho 1953 kg","brand":"1953","link":"https://www.festval.com/bife-de-patinho-1953-friboi-500g/p","items":[{"itemId":"5568","name":"Bife de Patinho 1953 kg","nameComplete":"Bife de Patinho 1953 kg","complementName":"Bife de Patinho 1953 Friboi kg","ean":"6484","measurementUnit":"kg","unitMultiplier":0.5000,"isKit":false,"sellers":[{"sellerId":"1","sellerName":"FESTVAL","commertialOffer":{"Price":76.98,"ListPrice":76.98,"FullSellingPrice":38.49,"AvailableQuantity":99999,"IsAvailable":true,"DiscountHighLight":[],"Teasers":[],"PromotionTeasers":[],"BuyTogether":[],"PaymentOptions":{"installmentOptions":[{"paymentSystem":"2","bin":null,"paymentName":"Visa","paymentGroupName":"creditCardPaymentGroup","value":3849,"installments":[{"count":1,"hasInterestRate":false,"interestRate":0,"value":3849,"total":3849,"sellerMerchantInstallments":[{"id":"MEUFESTVALDARK","count":1,"hasInterestRate":false,"interestRate":0,"value":3849,"total":3849}]}]},{"paymentSystem":"125","bin":null,"paymentName":"Pix","paymentGroupName":"instantPaymentPaymentGroup","value":3849,"installments":[{"count":1,"hasInterestRate":false,"interestRate":0,"value":3849,"total":3849,"sellerMerchantInstallments":[{"id":"MEUFESTVALDARK","count":1,"hasInterestRate":false,"interestRate":0,"value":3849,"total":3849}]}]}]}}}]}]},{"productId":"7040","productName":"Carne Moída de Patinho Reserva Friboi 400g","brand":"Friboi","link":"https://www.festval.com/patinho-moido-reserva-friboi-400g/p","items":[{"itemId":"6973","name":"Carne Moída de Patinho Reserva Friboi 400g","nameComplete":"Carne Moída de Patinho Reserva Friboi 400g","complementName":"Patinho Moído Reserva Friboi 400g","ean":"7896031213167","measurementUnit":"un","unitMultiplier":1.0000,"isKit":false,"sellers":[{"sellerId":"1","sellerName":"FESTVAL","commertialOffer":{"Price":29.98,"ListPrice":29.98,"FullSellingPrice":29.98,"AvailableQuantity":99999,"IsAvailable":true,"DiscountHighLight":[],"Teasers":[],"PromotionTeasers":[],"BuyTogether":[],"PaymentOptions":{"installmentOptions":[{"paymentSystem":"2","bin":null,"paymentName":"Visa","paymentGroupName":"creditCardPaymentGroup","value":2998,"installments":[{"count":1,"hasInterestRate":false,"interestRate":0,"value":2998,"total":2998,"sellerMerchantInstallments":[{"id":"MEUFESTVALDARK","count":1,"hasInterestRate":false,"interestRate":0,"value":2998,"total":2998}]}]},{"paymentSystem":"125","bin":null,"paymentName":"Pix","paymentGroupName":"instantPaymentPaymentGroup","value":2998,"installments":[{"count":1,"hasInterestRate":false,"interestRate":0,"value":2998,"total":2998,"sellerMerchantInstallments":[{"id":"MEUFESTVALDARK","count":1,"hasInterestRate":false,"interestRate":0,"value":2998,"total":2998}]}]}]}}}]}]},{"productId":"5614","productName":"Carne Moida de Patinho 1953 Aproximadamente 400g","brand":"1953","link":"https://www.festval.com/carne-moida-de-patinho-1953-friboi-400g/p","items":[{"itemId":"5621","name":"Carne Moida de Patinho 1953 Aproximadamente 400g","nameComplete":"Carne Moida de Patinho 1953 Aproximadamente 400g","complementName":"Carne moída de patinho Friboi 1953, ideal para preparar hambúrgueres, molhos, recheios e outras receitas do dia a dia. Embalagem com aproximadamente 400g.","ean":"6496","measurementUnit":"kg","unitMultiplier":0.4000,"isKit":false,"sellers":[{"sellerId":"1","sellerName":"FESTVAL","commertialOffer":{"Price":69.98,"ListPrice":69.98,"FullSellingPrice":27.99,"AvailableQuantity":99999,"IsAvailable":true,"DiscountHighLight":[],"Teasers":[],"PromotionTeasers":[],"BuyTogether":[],"PaymentOptions":{"installmentOptions":[{"paymentSystem":"2","bin":null,"paymentName":"Visa","paymentGroupName":"creditCardPaymentGroup","value":2799,"installments":[{"count":1,"hasInterestRate":false,"interestRate":0,"value":2799,"total":2799,"sellerMerchantInstallments":[{"id":"MEUFESTVALDARK","count":1,"hasInterestRate":false,"interestRate":0,"value":2799,"total":2799}]}]},{"paymentSystem":"125","bin":null,"paymentName":"Pix","paymentGroupName":"instantPaymentPaymentGroup","value":2799,"installments":[{"count":1,"hasInterestRate":false,"interestRate":0,"value":2799,"total":2799,"sellerMerchantInstallments":[{"id":"MEUFESTVALDARK","count":1,"hasInterestRate":false,"interestRate":0,"value":2799,"total":2799}]}]}]}}}]}]},{"productId":"2158","productName":"Pão Italiano Multigrãos Aproximadamente  344g/uni","brand":"Festval","link":"https://www.festval.com/pao-italiano-multigraos-kg/p","items":[{"itemId":"2164","name":"Pão Italiano Multigrãos kg","nameComplete":"Pão Italiano Multigrãos Aproximadamente  344g/uni Pão Italiano Multigrãos kg","complementName":"","ean":"3871","measurementUnit":"kg","unitMultiplier":0.3440,"isKit":false,"sellers":[{"sellerId":"1","sellerName":"FESTVAL","commertialOffer":{"Price":36.9,"ListPrice":36.9,"FullSellingPrice":12.69,"AvailableQuantity":99999,"IsAvailable":true,"DiscountHighLight":[],"Teasers":[],"PromotionTeasers":[],"BuyTogether":[],"PaymentOptions":{"installmentOptions":[{"paymentSystem":"2","bin":null,"paymentName":"Visa","paymentGroupName":"creditCardPaymentGroup","value":1269,"installments":[{"count":1,"hasInterestRate":false,"interestRate":0,"value":1269,"total":1269,"sellerMerchantInstallments":[{"id":"MEUFESTVALDARK","count":1,"hasInterestRate":false,"interestRate":0,"value":1269,"total":1269}]}]},{"paymentSystem":"125","bin":null,"paymentName":"Pix","paymentGroupName":"instantPaymentPaymentGroup","value":1269,"installments":[{"count":1,"hasInterestRate":false,"interestRate":0,"value":1269,"total":1269,"sellerMerchantInstallments":[{"id":"MEUFESTVALDARK","count":1,"hasInterestRate":false,"interestRate":0,"value":1269,"total":1269}]}]}]}}}]}]}]
