[{"productId":"186092","productName":"Banana da Terra Kg","brand":"Hortifruti","link":"https://www.supermuffato.com.br/banana-da-terra-kg-186092/p","items":[{"itemId":"186092","name":"Banana da Terra Kg","nameComplete":"Banana da Terra Kg","complementName":"Peso aprox. 150g/un","ean":"34791","measurementUnit":"kg","unitMultiplier":0.1500,"isKit":false,"sellers":[{"sellerId":"1","sellerName":"Super Muffato Delivery","commertialOffer":{"Price":13.4,"ListPrice":13.4,"FullSellingPrice":2.01,"IsAvailable":true,"AvailableQuantity":100,"DiscountHighLight":[],"Teasers":[],"PromotionTeasers":[],"BuyTogether":[],"PaymentOptions":{"installmentOptions":[{"paymentSystem":"2","bin":null,"paymentName":"Visa","paymentGroupName":"creditCardPaymentGroup","value":201,"installments":[{"count":1,"hasInterestRate":false,"interestRate":0,"value":201,"total":201,"sellerMerchantInstallments":[{"id":"MUFFATOSUPERMERCADOS","count":1,"hasInterestRate":false,"interestRate":0,"value":201,"total":201}]}]},{"paymentSystem":"125","bin":null,"paymentName":"Pix","paymentGroupName":"instantPaymentPaymentGroup","value":201,"installments":[{"count":1,"hasInterestRate":false,"interestRate":0,"value":201,"total":201,"sellerMerchantInstallments":[{"id":"MUFFATOSUPERMERCADOS","count":1,"hasInterestRate":false,"interestRate":0,"value":201,"total":201}]}]}]},"Installments":[{"Value":13.4,"InterestRate":0.0,"TotalValuePlusInterestRate":13.4,"NumberOfInstallments":1,"PaymentSystemName":"Visa","PaymentSystemGroupName":"creditCardPaymentGroup","Name":"Visa à vista"},{"Value":13.4,"InterestRate":0.0,"TotalValuePlusInterestRate":13.4,"NumberOfInstallments":1,"PaymentSystemName":"Pix","PaymentSystemGroupName":"instantPaymentPaymentGroup","Name":"Pix à vista"}]}}]}]},{"productId":"269830","productName":"Carne Bovina Bife De Patinho Kg","brand":"Muffato Foods","link":"https://www.supermuffato.com.br/carne-bovina-bife-de-patinho-kg-269830-1/p","items":[{"itemId":"269830","name":"Carne Bovina Bife De Patinho Kg","nameComplete":"Carne Bovina Bife De Patinho Kg","complementName":"","ean":"198196","measurementUnit":"kg","unitMultiplier":0.2500,"isKit":false,"sellers":[{"sellerId":"1","sellerName":"Super Muffato Delivery","commertialOffer":{"Price":58.7,"ListPrice":58.7,"FullSellingPrice":14.67,"IsAvailable":true,"AvailableQuantity":10,"DiscountHighLight":[],"Teasers":[],"PromotionTeasers":[],"BuyTogether":[],"PaymentOptions":{"installmentOptions":[{"paymentSystem":"2","bin":null,"paymentName":"Visa","paymentGroupName":"creditCardPaymentGroup","value":1467,"installments":[{"count":1,"hasInterestRate":false,"interestRate":0,"value":1467,"total":1467,"sellerMerchantInstallments":[{"id":"MUFFATOSUPERMERCADOS","count":1,"hasInterestRate":false,"interestRate":0,"value":1467,"total":1467}]}]},{"paymentSystem":"125","bin":null,"paymentName":"Pix","paymentGroupName":"instantPaymentPaymentGroup","value":1467,"installments":[{"count":1,"hasInterestRate":false,"interestRate":0,"value":1467,"total":1467,"sellerMerchantInstallments":[{"id":"MUFFATOSUPERMERCADOS","count":1,"hasInterestRate":false,"interestRate":0,"value":1467,"total":1467}]}]}]},"Installments":[{"Value":58.7,"InterestRate":0.0,"TotalValuePlusInterestRate":58.7,"NumberOfInstallments":1,"PaymentSystemName":"Visa","PaymentSystemGroupName":"creditCardPaymentGroup","Name":"Visa à vista"},{"Value":58.7,"InterestRate":0.0,"TotalValuePlusInterestRate":58.7,"NumberOfInstallments":1,"PaymentSystemName":"Pix","PaymentSystemGroupName":"instantPaymentPaymentGroup","Name":"Pix à vista"}]}}]}]},{"productId":"145168","productName":"Pão Manteiguinha Kg","brand":"Padaria","link":"https://www.supermuffato.com.br/pao-manteiguinha-kg-145168/p","items":[{"itemId":"145168","name":"Pão Manteiguinha Kg","nameComplete":"Pão Manteiguinha Kg","complementName":"","ean":"14199","measurementUnit":"kg","unitMultiplier":0.2500,"isKit":false,"sellers":[{"sellerId":"1","sellerName":"Super Muffato Delivery","commertialOffer":{"Price":20.5,"ListPrice":20.5,"FullSellingPrice":5.12,"IsAvailable":true,"AvailableQuantity":100,"DiscountHighLight":[],"Teasers":[],"PromotionTeasers":[],"BuyTogether":[],"PaymentOptions":{"installmentOptions":[{"paymentSystem":"2","bin":null,"paymentName":"Visa","paymentGroupName":"creditCardPaymentGroup","value":512,"installments":[{"count":1,"hasInterestRate":false,"interestRate":0,"value":512,"total":512,"sellerMerchantInstallments":[{"id":"MUFFATOSUPERMERCADOS","count":1,"hasInterestRate":false,"interestRate":0,"value":512,"total":512}]}]},{"paymentSystem":"125","bin":null,"paymentName":"Pix","paymentGroupName":"instantPaymentPaymentGroup","value":512,"installments":[{"count":1,"hasInterestRate":false,"interestRate":0,"value":512,"total":512,"sellerMerchantInstallments":[{"id":"MUFFATOSUPERMERCADOS","count":1,"hasInterestRate":false,"interestRate":0,"value":512,"total":512}]}]}]},"Installments":[{"Value":20.5,"InterestRate":0.0,"TotalValuePlusInterestRate":20.5,"NumberOfInstallments":1,"PaymentSystemName":"Visa","PaymentSystemGroupName":"creditCardPaymentGroup","Name":"Visa à vista"},{"Value":20.5,"InterestRate":0.0,"TotalValuePlusInterestRate":20.5,"NumberOfInstallments":1,"PaymentSystemName":"Pix","PaymentSystemGroupName":"instantPaymentPaymentGroup","Name":"Pix à vista"}]}}]}]},{"productId":"274553","productName":"Carne Bovina Moída Patinho Muffato Foods 320g","brand":"Muffato Foods","link":"https://www.supermuffato.com.br/carne-bov-moidacarne-bovina-moida-patinho-muffato-foods-320g-274553patinho-mf-320g-274553/p","items":[{"itemId":"274553","name":"Carne Bovina Moída Patinho Muffato Foods 320g","nameComplete":"Carne Bovina Moída Patinho Muffato Foods 320g","complementName":"","ean":"7896278183209","measurementUnit":"un","unitMultiplier":1.0000,"isKit":false,"sellers":[{"sellerId":"1","sellerName":"Super Muffato Delivery","commertialOffer":{"Price":26.8,"ListPrice":26.8,"FullSellingPrice":26.8,"IsAvailable":true,"AvailableQuantity":99999,"DiscountHighLight":[],"Teasers":[],"PromotionTeasers":[],"BuyTogether":[],"PaymentOptions":{"installmentOptions":[{"paymentSystem":"2","bin":null,"paymentName":"Visa","paymentGroupName":"creditCardPaymentGroup","value":2680,"installments":[{"count":1,"hasInterestRate":false,"interestRate":0,"value":2680,"total":2680,"sellerMerchantInstallments":[{"id":"MUFFATOSUPERMERCADOS","count":1,"hasInterestRate":false,"interestRate":0,"value":2680,"total":2680}]}]},{"paymentSystem":"125","bin":null,"paymentName":"Pix","paymentGroupName":"instantPaymentPaymentGroup","value":2680,"installments":[{"count":1,"hasInterestRate":false,"interestRate":0,"value":2680,"total":2680,"sellerMerchantInstallments":[{"id":"MUFFATOSUPERMERCADOS","count":1,"hasInterestRate":false,"interestRate":0,"value":2680,"total":2680}]}]}]},"Installments":[{"Value":26.8,"InterestRate":0.0,"TotalValuePlusInterestRate":26.8,"NumberOfInstallments":1,"PaymentSystemName":"Visa","PaymentSystemGroupName":"creditCardPaymentGroup","Name":"Visa à vista"},{"Value":26.8,"InterestRate":0.0,"TotalValuePlusInterestRate":26.8,"NumberOfInstallments":1,"PaymentSystemName":"Pix","PaymentSystemGroupName":"instantPaymentPaymentGroup","Name":"Pix à vista"}]}}]}]}]
